,title,runtime,mpaa_rating,theatrical_release,director,actor,plot
744,Starter for 10,96,PG-13,2006-02-23,Tom Vaughan,"James McAvoy, Alice Eve, Rebecca Hall, Catherine Tate, Dominic Cooper","In 1985, against the backdrop of Thatcherism, Brian Jackson enrolls in the University of Bristol, a scholarship boy from seaside Essex with a love of knowledge for its own sake and a childhood spent watching ""University Challenge,"" a college quiz show. At Bristol he tries out for the Challenge team and falls under the spell of Alice, a lovely blond with an extensive sexual past. He's smitten, and he carelessly manages to hurt the feelings of Rebecca Epstein, a friend whose politics and wit he admires. The Challenge finale is coming up; maybe Brian can redeem himself and still avoid being a prat."
745,Stomp the Yard,114,PG-13,2007-01-12,Sylvain White,"Columbus Short, Meagan Good, Ne-Yo, Darrin Dewitt Henson, Brian J. White","After the death of his brother, An expert street dancer goes to Georgia to attend Truth University. But his efforts to get an education and woo the girl he likes are sidelined when he joins in his fraternity's effort to win a step dancing competition."
746,Sunshine,107,R,2007-07-27,Danny Boyle,"Cillian Murphy, Chris Evans, Rose Byrne, Michelle Yeoh, Hiroyuki Sanada",A team of international astronauts is sent on a dangerous mission to reignite the dying Sun with a nuclear fission bomb in 2057.
747,Superbad,113,R,2007-08-17,Greg Mottola,"Jonah Hill, Michael Cera, Bill Hader, Christopher Mintz-Plasse, Seth Rogen",Two co-dependent high school seniors are forced to deal with separation anxiety after their plan to stage a booze-soaked party goes awry.
748,Surf's Up,85,PG,2007-06-08,"Ash Brannon, Chris Buck","Shia LaBeouf, Jeff Bridges, Zooey Deschanel, James Woods, Diedrich Bader","This story follows a teenage rock hopper penguin named Cody Maverick from his hometown of Shiverpool, Antarctica, where all of the other penguins think he's nothing but a surfing fool, to the ""Big Z Memorial Surf Off"" on Pen Gu Island. Young Cody is determined to win the most important competition in the world of penguin surfing in honor of ""Big Z,"" a deceased surfing legend whom he has idolized since childhood. But the waves in Pen Gu are different than in Shiverpool, and the competition is steep. The current champ, egotistical Tank Evans, isn't just about to let this little penguin knock him from first place without a fight. When Cody wipes out and encounters Geek, a recluse aging former surfer, living in the jungle, he learns some important lessons about life and surfing, and even teaches Geek a thing or two."
749,Sweeney Todd: The Demon Barber of Fleet Street,116,R,2007-12-21,Tim Burton,"Johnny Depp, Helena Bonham Carter, Alan Rickman, Timothy Spall, Sacha Baron Cohen","The infamous story of Benjamin Barker, AKA Sweeney Todd, who sets up a barber shop down in London which is the basis for a sinister partnership with his fellow tenant, Mrs. Lovett. Based on the hit Broadway musical."
750,TMNT,86,PG,2007-03-23,Kevin Munroe,"Chris Evans, Sarah Michelle Gellar, Mako, Patrick Stewart, Mitchell Whitfield","After the defeat of their old arch nemesis, The Shredder, the Turtles are needed more than ever, but Raphael, Donatello, and Michelangelo have become lost and direction less. Leonardo has gone to Central America, on the orders of the martial arts master and father figure Master Splinter, for training. Donatello and Michelangelo have started small businesses in Leonardo's absence. Meanwhile, strange things are happening in New York City. An army of ancient creatures threatens to take over the world and the Turtles must unite again to save it."
751,Talk to Me,118,R,2007-07-27,Kasi Lemmons,"Don Cheadle, Chiwetel Ejiofor, Benz Antoinee, Cedric the Entertainer, Carolyn Barrett","The true life story of Ralph Waldo ""Petey"" Greene Jr. In the mid-to-late 1960s, in Washington, D.C., vibrant soul music and exploding social consciousness were combining to unique and powerful effect. It was the place and time for Petey to fully express himself - sometimes to outrageous effect - and ""tell it like it is."" With the support of his irrepressible and tempestuous girlfriend Vernell, the newly minted ex-con talks his way into an on-air radio gig. He forges a friendship and a partnership with fellow prison inmate Milo's brother Dewey Hughes. From the first wild morning on the air, Petey relies on the more straight-laced Dewey to run interference at WOL-AM, where Dewey is the program director. At the station, Petey becomes an iconic radio personality, surpassing even the established popularity of his fellow disc jockeys, Nighthawk and Sunny Jim. Combining biting humor with social commentary, Petey openly courts controversy for station owner E.G. Sonderling. Petey was determined to make not just himself but his community heard during an exciting and turbulent period in American history. As Petey's voice, humor, and spirit surge across the airwaves with the vitality of the era, listeners tune in to hear not only incredible music but also a man speaking directly to them about race and power in America like few people ever have. Through the years, Petey's ""The truth just is"" style --- on - and off-air - would redefine both Petey and Dewey, and empower each to become the man he would most like to be."
752,Taxi to the Dark Side,106,R,2007-04-28,Alex Gibney,"Moazzam Begg, Willie Brand, Jack Cloonan, Damien Corsetti, Scott Horton",Alex Gibney exposes the haunting details of the USA's torture and interrogation practices during the War in Afghanistan.
753,The Abandoned,99,R,2007-02-23,Nacho Cerda,"Anastasia Hille, Karel Roden, Valentin Ganev, Carlos Reig-Plaza, Marta Yaneva","In 1966, somewhere in Russia, a wounded woman drives a truck to an isolated farm with two babies. Forty years later, the film producer Marie Jones leaves her daughter in California and travels back to her home land in the wilderness of Russia. Marie is one of the children and had received a phone call from the notary public Andrei Misharin that had told her where the farm of her family is. Marie arrives in the abandoned house and meets the stranger Nicolai that tells her that he had also received a call from Misharin and he is her twin brother. Weird things happen in the house and Marie and Nicolai are haunted by eerie ghosts of themselves. Further, they find that they are trapped in the house and can not leave the place."
754,The Assassination of Jesse James by the Coward Robert Ford,159,R,2007-10-05,Andrew Dominik,"Brad Pitt, Casey Affleck, Mary-Louise Parker, Brooklynn Proulx, Sam Rockwell","Robert Ford, who's idolized Jesse James since childhood, tries hard to join the reforming gang of the Missouri outlaw, but gradually becomes resentful of the bandit leader."
755,The Astronaut Farmer,104,PG,2006-10-15,Michael Polish,"Billy Bob Thornton, Virginia Madsen, Bruce Dern, Tim Blake Nelson, Jasper Polish","Texan Charles Farmer left the Air Force as a young man to save the family ranch when his dad died. Like most American ranchers, he owes his bank. Unlike most, he's an astrophysicist with a rocket in his barn - one he's built and wants to take into space. It's his dream. The FBI puts him under surveillance when he tries to buy rocket fuel; the FAA stalls him when he files a flight plan - it's post-9/11, after all. His wife is angry when she finds out their bank is initiating foreclosure. Charlie fears failure and decides, precipitously, to launch. Are twenty-first century American dreams just a sign of insanity? Are those who believe in dreamers only fools?"
756,The Bourne Ultimatum,115,PG-13,2007-08-03,Paul Greengrass,"Matt Damon, Julia Stiles, David Strathairn, Scott Glenn, Paddy Considine","Bourne is once again brought out of hiding, this time inadvertently by London-based reporter Simon Ross who is trying to unveil Operation Blackbriar--an upgrade to Project Treadstone--in a series of newspaper columns. Bourne sets up a meeting with Ross and realizes instantly they're being scanned. Information from the reporter stirs a new set of memories, and Bourne must finally, ultimately, uncover his dark past whilst dodging The Company's best efforts in trying to eradicate him."
757,The Brave One,122,R,2007-09-14,Neil Jordan,"Jodie Foster, Terrence Howard, Nicky Katt, Naveen Andrews","David Kirmani,a medical professional, lives in an apartment with his sweetheart, Erica Bain, a radio host, and his dog. They usually take the dog out for a stroll in nearby Central Park and let him run and fetch. One day while at the park they let the dog run without a leash, and when he does not return or respond to their calls, they frantically search for him. They eventually find him being held by three men who want a reward. When David refuses, they start to molest Erica and David intervenes. Two of the men assault the couple, while the third uses a camcorder to film this incident. Erica is knocked unconscious, and regains her senses several days later in a hospital. She is told the shocking news that David was killed and the dog is missing. A traumatized Erica returns home to try and regain her life. She also visits the police station but does not get much help. Fearful of a repeat of this type of incident, she gets an unlicensed gun and carries it with her all the time. One day she witnesses some youths terrorizing subway passengers, forcing them to get off at the next station. When they approach her, she shoots them dead. She uses her gun several more times, always gunning down people committing violent crimes. One day she is summoned to the police station to identify a man who may have been responsible for David's death and the assault on herself. She does recognize him, but refuses to identify him. Subsequently she finds out his whereabouts and plans to avenge her lover's death, not realizing that Detective Mercer has her as a suspect in the recent killings and is set to apprehend her. The question remains: will Erica be able to avenge David's death and her attack before being arrested herself?"
758,The Brothers Solomon,93,R,2007-09-07,Bob Odenkirk,"Will Arnett, Will Forte, Chi McBride, Kristen Wiig, Malin Akerman","John and Dean Solomon may have Ph.D.s, but they're socially inept after their widowed father home-schooled them in Antarctica. When their beloved dad falls into a coma, they hatch a plan to revive him using a positive emotional shock - giving him a grandchild. They find a surrogate mom through Craig's list - she's Janine, a penniless local musician, with a large, intimidating boyfriend, James. The pregnancy gives the Solomons nine months to learn to be parents. In a side story, John pursues Tara, a neighbor who takes care of their dad when John and Dean are out; but she has no interest in John. Can the boys keep Janine and James happy, keep dad alive, and learn to be dads?"
759,The Bucket List,97,PG-13,2007-12-25,Rob Reiner,"Jack Nicholson, Morgan Freeman, Sean Hayes, Beverly Todd, Alfonso Freeman","Corporate billionaire Edward Cole and working class mechanic Carter Chambers have nothing in common except for their terminal illnesses. While sharing a hospital room together, they decide to leave it and do all the things they have ever wanted to do before they die according to their bucket list. In the process, both of them heal each other, become unlikely friends, and ultimately find joy in life."
760,The Comebacks,87,PG-13,2007-10-19,Tom Brady,"David Koechner, Carl Weathers, Melora Hardin, Matthew Lawrence, Brooke Nevin","A comedy that spoofs the inspirational sports movies, The Comebacks tells the story of an out-of-luck coach, Lambeau Fields, who takes a rag-tag bunch of college misfits and drives them towards the football championships. In the process, this life-long loser discovers that he is a winner after all by redeeming himself, saving his relationship with his family and friends, and finding that there is..."
761,The Condemned,113,R,2007-04-27,Scott Wiper,"Vinnie Jones, Rick Hoffman, Madeline West, Steve Austin, Steve Austin","The story of Jack Conrad, who is awaiting the death penalty in a corrupt Central American prison. He is ""purchased"" by a wealthy television producer and taken to a desolate island where he must fight to the death against nine other condemned killers from all corners of the world, with freedom going to the sole survivor."
762,The Counterfeiters,99,R,2007-02-10,Stefan Ruzowitzky,"Karl Markovics, August Diehl, Devid Striesow, Dolores Chaplin, August Zirner","The Counterfeiters is the true story of the largest counterfeiting operation in history, set up by the Nazis in 1936. Salomon ""Sally"" Sorowitsch is the king of counterfeiters. He lives a mischievous life of cards, booze, and women in Berlin during the Nazi-era. Suddenly his luck runs dry when arrested by Superintendent Friedrich Herzog. Immediately thrown into the Mauthausen concentration camp, Salomon exhibits exceptional skills there and is soon transferred to the upgraded camp of Sachsenhausen. Upon his arrival, he once again comes face to face with Herzog, who is there on a secret mission. Hand-picked for his unique skill, Salomon and a group of professionals are forced to produce fake foreign currency under the program Operation Bernhard. The team, which also includes detainee Adolf Burger, is given luxury barracks for their assistance. But while Salomon attempts to weaken the economy of Germany's allied opponents, Adolf refuses to use his skills for Nazi profit and would like to do something to stop Operation Bernhard's aid to the war effort. Faced with a moral dilemma, Salomon must decide whether his actions, which could prolong the war and risk the lives of fellow prisoners, are ultimately the right ones."
763,The Darjeeling Limited,91,R,2007-10-26,Wes Anderson,"Owen Wilson, Adrien Brody, Jason Schwartzman, Amara Karan, Wallace Wolodarsky","A year after their father's funeral, three brothers travel across India by train in an attempt to bond with each other."
764,The Diving Bell and the Butterfly,112,PG-13,2007-11-30,Julian Schnabel,"Mathieu Amalric, Emmanuelle Seigner, Anne Consigny, Max von Sydow, Marie-Josee Croze",The true story of Elle editor Jean-Dominique Bauby who suffers a stroke and has to live with an almost totally paralyzed body; only his left eye isn't paralyzed.
765,The Ex,84,PG-13,2007-05-11,Jesse Peretz,"Amanda Peet, Jason Bateman, Charles Grodin, Mia Farrow, Zach Braff","In Manhattan, Sofia's an attorney and Tom's a cook who has a hard time holding a job. When their first child is born, they agree that she'll be a full-time mom and he'll get a promotion. When he gets fired, he takes a job in Ohio working at the ad agency where her father is assistant director. Tom's assigned to report to Chip, a competitive, hard-driving guy who's in a wheelchair and who's Sofia's ex-boyfriend - from high school. Chip still carries a torch for her, so he connives to make Tom's work life miserable. As Tom's frustrations mount, it may be that Sofia will take Chip's side. Is Tom doomed to fail yet again?"
766,The Final Season,119,PG,2007-10-12,David M. Evans,"Sean Astin, Powers Boothe, Rachael Leigh Cook, James Gammon, Larry Miller","True story of Kent Stock, who in the early 90's, gives up a job to take over as head coach as the Norway High School baseball team. Kent must win over his players and convince them and himself that he can fill their former coach's shoes and that they can go out winners. In the summer of 1991 Norway High's baseball tradition ended on a triumphant but sombre note."
767,The Game Plan,110,PG,2007-09-28,Andy Fickman,"Dwayne Johnson, Madison Pettis, Kyra Sedgwick, Roselyn Sanchez, Morris Chestnut","Joe Kingman is a huge football star. He's got women, money, and a good career. Everything is perfect for him. Then one day an 8 year old girl shows up at his door telling him that she's his daughter from a past relationship. Once he has proof that she is for a fact his, he tries but fails miserably at ""parenting."" From problems such as his super speedy car with no backseat, to leaving her in a bar at 3 am, he's got a lot to deal with. Eventually though, she gets him, (and his football team) wrapped around her finger. When she has a near-death experience and Joe finds out her mother died early that year, he wants her to move and live with him. Her aunt though disagrees and takes her home. Joe has to play the game of his life and when he's injured, and things don't look good for him, his daughter comes out and gets him right back on the field."
768,The Golden Compass,113,PG-13,2007-12-07,Chris Weitz,"Nicole Kidman, Daniel Craig, Dakota Blue Richards, Sam Elliott, Ben Walker","It was no ordinary life for a young girl: living among scholars in the hallowed halls of Jordan College and tearing unsupervised through Oxford's motley streets on mad quests for adventure. But Lyra's greatest adventure would begin closer to home, the day she heard hushed talk of an extraordinary particle. Microscopic in size, the magical dust--discovered in the vast Arctic expanse of the North--was rumored to possess profound properties that could unite whole universes. But there were those who feared the particle and would stop at nothing to destroy it. Catapulted into the heart of a terrible struggle, Lyra was forced to seek aid from clans, 'gyptians, and formidable armored bears. And as she journeyed into unbelievable danger, she had not the faintest clue that she alone was destined to win, or to lose, this more-than-mortal battle..."
769,The Heartbreak Kid,115,R,2007-10-05,"Peter Farrelly, Bobby Farrelly","Ben Stiller, Michelle Monaghan, Jerry Stiller, Malin Akerman, Carlos Mencia","Eddie is forty, owns a sporting-goods store, and is still single. After watching his ex-fiancée walk down the aisle, he meets Lila, an environmental researcher, who seems too good to be true. Pressured by his father and best friend, Eddie pops the question and marries Lila after only 6 weeks. However, as he almost instantly discovers, his new bride is a nightmare with more baggage than he can handle. She's immature, foolish, a monster in bed, owes a tremendous amount of money to various sources, and as it turns out, is only a volunteer and doesn't actually have a job. While on their honeymoon in Cabo, Eddie meets Miranda, a down-to-earth lacrosse coach who is visiting with her family. Sparks fly, and Eddie falls for her. Now comes the tricky part of breaking off his marriage to crazy Lila, all while keeping the truth from Miranda about why he's in Cabo in the first place..."
770,The Hills Have Eyes 2,90,R,2007-03-23,Martin Weisz,"Michael McMillian, Jessica Stroup, Jacob Vargas, Flex Alexander, Reshad Strik","A team of trainees of the National Guard brings supply to the New Mexico Desert for a group of soldiers and scientists that are installing a monitoring system in Sector 16. They do not find anybody in the camp, and they receive a blurred distress signal from the hills. Their sergeant gathers a rescue team, and they are attacked and trapped by deformed cannibals, having to fight to survive."
771,The Hitcher,84,R,2007-01-19,Dave Meyers,"Sean Bean, Sophia Bush, Zachary Knighton, Neal McDonough, Danny Bolero","While driving through the New Mexico Desert during a rainy night, the college students Jim Halsey and his girlfriend Grace Andrews give a ride to the hitchhiker John Ryder. While in their car, the stranger proves to be a psychopath threatening the young couple with a knife, but Jim succeeds to throw him out of the car on the road. On the next morning, the young couple sees John in another car with a family, and while trying to advise the driver that the man is dangerous, they have an accident. While walking on the road, they find the whole family stabbed in the car, and John sees that the driver is still alive. He drives to a restaurant seeking for help, but the police blame Jim and Grace to the murder and send them to the police station. However, John kills the policemen and pursues the couple, playing a tragic and violent mouse and cat game with Grace and Jim."
772,The Hoax,115,R,2007-04-06,Lasse Hallstrom,"Richard Gere, Alfred Molina, Marcia Gay Harden, Julie Delpy, Hope Davis","In what would cause a fantastic media frenzy, Clifford Irving sells his bogus biography of Howard Hughes to a premiere publishing house in the early 1970s."
773,The Hunting Party,104,R,2007-09-14,Richard Shepard,"Richard Gere, Terrence Howard, Jesse Eisenberg, James Brolin, Ljubomir Kerekes","A young journalist, a seasoned cameraman and a discredited war correspondent embark on an unauthorized mission to find the no. 1 war criminal in Bosnia; they find themselves in serious jeopardy when they are mistaken as a CIA hit squad and their target decides to come after them."
774,The Invasion,99,PG-13,2007-08-17,Oliver Hirschbiegel,"Nicole Kidman, Daniel Craig, Jeremy Northam, Jeffrey Wright, Jackson Bond","As a Washington psychiatrist unearths the origin of an alien epidemic, she also discovers her son might be the only way it can be stopped."
775,The Invisible,101,PG-13,2007-04-27,David S. Goyer,"Justin Chatwin, Margarita Levieva, Marcia Gay Harden, Alex O'Loughlin, Callum Keith Rennie","Nick Powell is an excellent high-school student who raises money by selling homework and results of quizzes to his schoolmates. He aims to travel to London for a writer's course - telling his best friend, Pete Egan, that he has already bought the airplane ticket but he has not told to his mother yet. Annie Newton has a problem with Pete, who owes money to her. As events unfold, due to a case of mistaken identity Nick takes a severe beating from Annie and her gang, his body dumped in a sewer. The next morning, he discovers he cannot be seen - he is now a spirit in a state of limbo and can only observe as the events of that day unfold."
776,The Jane Austen Book Club,106,PG-13,2007-10-05,Robin Swicord,"Kathy Baker, Maria Bello, Emily Blunt, Amy Brenneman, Hugh Dancy","Six Californians start a club to discuss the works of Jane Austen, only to find their relationships -- both old and new -- begin to resemble 21st century versions of her novels."
777,The Kingdom,110,R,2007-09-28,Peter Berg,"Jamie Foxx, Chris Cooper, Jennifer Garner, Jason Bateman, Ashraf Barhom","After a terrorist attack on an American housing compound in Riyadh, Saudi Arabia, where families and FBI Agent Francis Manner are murdered, FBI agent Ronald Fleury blackmails the Saudi Arabian consul to get five days of investigation in the location. He travels with agent Grant Sykes, Janet Mayes and Adam Leavitt to avenge their friend and try to find those responsible for the bombing. The agents find all sorts of difficulties in their investigation, but they are supported by Colonel Faris Al Ghazi that advises the team how to act in a hostile environment."
778,The Kite Runner,127,PG-13,2007-12-14,"Marc Forster, Rebecca Yeldham","Shaun Toub, Atossa Leoni, Homayon Ershadi, Ahmad Khan Mahmoodzada, Khalid Abdalla","In the 70's in Afghanistan, the Pushtun boy Amir and the Hazara boy Hassan, who is his loyal friend and son of their Hazara servant Ali, are raised together in Amir's father house, playing and kitting on the streets of a peaceful Kabul. Amir feels that his wise and good father Baba blames him for the death of his mother in the delivery, and also that his father loves and prefers Hassan to him. In return, Amir feels a great respect for his father's best friend Rahim Khan, who supports his intention to become a writer. After Amir winning a competition of kitting, Hassan runs to bring a kite to Amir, but he is beaten and raped by the brutal Assef in an empty street to protect Amir's kite; the coward Amir witness the assault but does not help the loyal Hassam. On the day after his birthday party, Amir hides his new watch in Hassam's bed to frame the boy as a thief and force his father to fire Ali, releasing his conscience from recalling his cowardice and betrayal. In 1979, the Russians invade Afghanistan and Baba and Amir escape to Pakistan. In 1988, they have a simple life in Fremont, California, when Amir graduates in a public college for the pride and joy of Baba. Later Amir meets his countrywoman Soraya and they get married. In 2000, after the death of Baba, Amir is a famous novelist and receives a phone call from the terminal Rahim Khan, who discloses secrets about his family, forcing Amir to return to Peshawar, in Pakistan, in a journey of redemption."
779,The Last Legion,101,PG-13,2007-08-17,Doug Lefler,"Colin Firth, Ben Kingsley, Aishwarya Rai Bachchan, Peter Mullan, Kevin Mckidd","Circa 460 A.D. Mira was born in a warrior-family in Kerala, India, was well versed in martial arts and self-defense, so much so that she was recruited by the Spanish royalty and re-located to Constantinople. From there she was instructed to assist Roman Commander Aurelius to plan the escape of 12-year old Romulus Augustus Caesar from a prison in Capri after his parents had been killed by the leader of the Alliance in turmoil-stricken Rome that has seen the deaths of five emperors in five years. Mira, Aurelius, and a Priest, Ambrosinius, along with a handful of loyal soldiers were successful in the escape plan and deliver Romulus to Roman Senator Nestor. What the crew do not realize is that their task is not over yet, for Nestor is all set to betray Romulus, leaving them with no alternative but to flee to Britannia, where they will be forced to confront a seemingly invincible Vortygn, whose main aim is to obtain a powerful sword that was meant for defense and defeat, and also ensure the death of Romulus at any and all costs."
