,title,runtime,mpaa_rating,theatrical_release,director,actor,plot
251,A Sound of Thunder,102,PG-13,2005-09-02,"Ben Kingsley, Peter Hyams","Catherine McCormack, Ben Kingsley, Jemima Rooper, David Oyelowo, Edward Burns","2055, Charles Hatton has made a fortune by founding 'Time safari', which offers rich 'big game hunters' short time travels to kill off dinosaurs just before their natural death. When Travis notices the weather and wildlife are not behaving as usual, he consults Dr. Rand, the contractually invisible inventor of the supercomputer which controls the time travel. They soon face 'time waves', each worsening the effects in 2055 of evolutionary distortions, lower lifeforms first. They attempt to identify and rectify the past alteration, but each attempt gets harder in their distorted present."
252,Alone in the Dark,96,R,2005-01-28,Uwe Boll,"Christian Slater, Tara Reid, Stephen Dorff, Frank C. Turner, Mathew Walker","Edward Carnby, detective of the paranormal, unexplained and supernatural, investigates a mystery (the recent death of a friend) with clues leading to ""Shadow Island"" that brings him face to face with bizarre horrors that prove both psychologically disturbing and lethal, as he discovers that evil demons worshiped by an ancient culture called the Abskani are planning on coming back to life in the 21st century to once again take over the world... and only he and a young genius anthropologist with an incredible memory (and his ex-girlfriend), Aline Cedrac, stand in their way, at a gateway to hell. Standing in Carnby's way, however, is the impact that a brief encounter with an evil spirit called the Queen had upon his mind, as he slowly finds himself overpowered by the forces of darkness as they eat away at his very sanity..."
253,An Unfinished Life,107,PG-13,2005-09-09,Lasse Hallstrom,"Robert Redford, Jennifer Lopez, Morgan Freeman, Josh Lucas, Damian Lewis","To escape an abusive boyfriend, without announcing her plans in advance, Jean Gilkyson takes her young daughter Griff to the Wyoming ranch of her father-in-law, Einar. Jean and Einar are disaffected, as he blames her for the death of his son in a car accident. Einar is taking care of his friend Mitch, who was attacked by a bear, and Einar does not know that he has a granddaughter. While Mitch heals and forgives the bear, Einar also changes his feelings regarding Jean, finally understanding that accidents happen and accepting her and loving Griff."
254,Are We There Yet?,95,PG,2005-01-20,Brian Levant,"Ice Cube, Nia Long, Aleisha Allen, Philip Daniel Bolden, Jay Mohr","Nick Persons is a selfish player who owns a collectables sports shop in New York. Everything in his life is perfect until he meets Suzanne Kingston, a business woman who has something Nick ..."
255,Assault on Precinct 13,108,R,2005-01-19,Jean-Francois Richet,"Ethan Hawke, Laurence Fishburne, John Leguizamo, Maria Bello, Ja Rule","A police sergeant must rally the cops and prisoners together to protect themselves on New Year's Eve, just as corrupt policeman surround the station with the intent of killing all to keep their deception in the ranks."
256,Bad News Bears,113,PG-13,2005-07-22,Richard Linklater,"Billy Bob Thornton, Greg Kinnear, Marcia Gay Harden, Sammi Kane Kraft, Jeff Davies","Morris Buttermaker, an alcoholic pest removal worker and former professional baseball player (for a very short time), is recruited to coach and train a failing baseball team of 12-year-olds which is about to be thrown out of the league."
257,Batman Begins,140,PG-13,2005-06-14,Christopher Nolan,"Christian Bale, Michael Caine, Liam Neeson, Katie Holmes, Gary Oldman","After training with his mentor, Batman begins his war on crime to free the crime-ridden Gotham City from corruption that the Scarecrow and the League of Shadows have cast upon it."
258,Be Cool,119,PG-13,2005-03-04,F. Gary Gray,"John Travolta, Uma Thurman, Vince Vaughn, Cedric the Entertainer, Andre Benjamin","Streetwise mobster-turned-movie producer Chili Palmer is back, but this time Chili has abandoned the fickle movie industry and veered into the music business, tangling with Russian mobsters and gangsta rappers and taking a talented, feisty young singer named Linda Moon under his wing. From the recording studio to an Aerosmith concert to the MTV Music Awards, he manipulates events to watch them play out the Chili way, using his signature blend of wiseguy skills and negotiation tactics. It's a dangerous business, and everyone's looking for their next big hit."
259,Beauty Shop,105,PG-13,2005-03-30,Bille Woodruff,"Queen Latifah, Andie MacDowell, Alfre Woodard, Mena Suvari, Alicia Silverstone",A determined hairstylist (Queen Latifah) competes with her former boss (Kevin Bacon) after opening her own business in Atlanta.
260,Because of Winn-Dixie,107,PG,2005-02-18,Wayne Wang,"Annasophia Robb, Jeff Daniels, Cicely Tyson, Dave Matthews, Eva Marie Saint","A 10-year-old girl, abandoned by her mother when she was three, moves to a small town in Florida with her father, a preacher. While there, she adopts a stray dog whom she names after the local supermarket where he was found. With her goofy pooch by her side, she meets an eclectic group of townspeople and rekindles an almost lost relationship with her father."
261,Bewitched,102,PG-13,2005-06-24,Nora Ephron,"Nicole Kidman, Will Ferrell, Shirley MacLaine, Michael Caine, Jason Schwartzman","Out in California's San Fernando Valley, Isabel is trying to reinvent herself. A naïve, good-natured witch, she is determined to disavow her supernatural powers and lead a normal life. At the same time, across town, Jack Wyatt a tall, charming actor is trying to get his career back on track. He sets his sights on an updated version of the beloved 1960s situation comedy Bewitched, re-conceived as a starring vehicle for himself in the role of the mere-mortal Darrin. Fate steps in when Jack accidentally runs into Isabel. He is immediately attracted to her and her nose, which bears an uncanny resemblance to the nose of Elizabeth Montgomery, who played Samantha in the original TV version of Bewitched. He becomes convinced she could play the witch Samantha in his new series. Isabel is also taken with Jack, seeing him as the quintessential mortal man with whom she can settle down and lead the normal life she so desires. It turns out they're both right--but in ways neither of them ever imagined."
262,Boogeyman,88,R,2005-02-04,Stephen T. Kay,"Barry Watson, Emily Deschanel, Skye McCole Bartusiak, Lucy Lawless, Tory Mussett","Every culture has one - The horrible monster fueling young children's nightmares. But for Tim, the BOGEYMAN still lives in his memories as a creature that devoured his father 16 years earlier. Is the BOGEYMAN real? Or did Tim make him up to explain why his father abandoned his family? The answer lies hidden behind every dark corner and half-opened closet of his childhood home - A place he must return to and face the chilling unanswered questions... Dies the BOGEYMAN really exist?"
263,Brokeback Mountain,134,R,2005-12-09,Ang Lee,"Heath Ledger, Jake Gyllenhaal, Anne Hathaway, Michelle Williams, Randy Quaid","Two young men, Ennis Del Mar and Jack Twist, meet when they get a job as sheep herders on Brokeback Mountain. They are at first strangers, then they become friends. Throughout the weeks, they grow closer as they learn more about each other. One night, after some heavy drinking, they find a deeper connection. They then indulge in a blissful romance for the rest of the summer. Unable to deal with their feelings for each other, they part ways at the end of the summer. Four years go by, and they each settle down, Ennis in Wyoming with his wife and two girls, and Jack in Texas with his wife and son. Still longing for each other, they meet back up, and are faced with the fact that they need each other. They undeniably need each other, and unsure of what to do, they start a series of ""fishing trips"", in order to spend time together. The relationship struggles on for years until tragedy strikes."
264,Capote,115,R,2005-09-30,Bennett Miller,"Philip Seymour Hoffman, Catherine Keener, Chris Cooper, Bruce Greenwood, Bob Balaban","In 1959, Truman Capote learns of the murder of a Kansas family and decides to write a book about the case. While researching for his novel In Cold Blood, Capote forms a relationship with one of the killers, Perry Smith, who is on death row."
265,Casanova,110,R,2005-12-25,Lasse Hallstrom,"Heath Ledger, Sienna Miller, Jeremy Irons, Oliver Platt, Lena Olin","Casanova is in love with Francesca, who thinks he is a friend of himself even though he is engaged to Victoria, who is the love of Giovanni, Francesca's brother. Francesca is betrothed to Paprizzio who thinks Casanova is the feminist writer Guardi, who is really Francessca's nomme de plume. Amidst all these secret identities and misunderstandings, the Catholic Church sends Pucci to bring Casanova and Guardi to trial for heresy."
266,Charlie and the Chocolate Factory,130,PG,2005-07-15,Tim Burton,"Johnny Depp, Freddie Highmore, David Kelly, Helena Bonham Carter, Noah Taylor","When Willy Wonka decides to let five children into his chocolate factory, he decides to release five golden tickets in five separate chocolate bars, causing complete mayhem. The tickets start to be found, with the fifth going to a very special boy, called Charlie Bucket. With his Grandpa, Charlie joins the rest of the children to experience the most amazing factory ever. But not everything goes to plan within the factory."
267,Cheaper by the Dozen 2,93,PG,2005-12-21,Adam Shankman,"Steve Martin, Bonnie Hunt, Eugene Levy, Tom Welling, Hilary Duff","Steve Martin and Bonnie Hunt return as heads of the Baker family who, while on vacation, find themselves in competition with a rival family of eight children, headed by Eugene Levy."
268,Chicken Little,82,G,2005-11-04,Mark Dindal,"Garry Marshall, Patrick Stewart, Joan Cusack, Amy Sedaris, Zach Braff","After Chicken Little causes widespread panic--when he mistakes a falling acorn for a piece of the sky--the young chicken is determined to restore his reputation. But just as things are starting to go his way, a real piece of the sky lands on his head. Chicken Little and his band of misfit friends, Abby Mallard (aka Ugly Duckling), Runt of the Litter and Fish Out of Water, attempt to save the world without sending the town into a whole new panic."
269,Cinderella Man,144,PG-13,2005-05-29,Ron Howard,"Russell Crowe, Renee Zellweger, Paul Giamatti, Craig Bierko, Paddy Considine","During the Great Depression, a common-man hero, James J. Braddock--a.k.a. the Cinderella Man--was to become one of the most surprising sports legends in history. By the early 1930s, the impoverished ex-prizefighter was seemingly as broken-down, beaten-up and out-of-luck as much of the rest of the American populace who had hit rock bottom. His career appeared to be finished, he was unable to pay the bills, the only thing that mattered to him--his family--was in danger, and he was even forced to go on Public Relief. But deep inside, Jim Braddock never relinquished his determination. Driven by love, honor and an incredible dose of grit, he willed an impossible dream to come true. In a last-chance bid to help his family, Braddock returned to the ring. No one thought he had a shot. However Braddock, fueled by something beyond mere competition, kept winning. Suddenly, the ordinary working man became the mythic athlete. Carrying the hopes and dreams of the disenfranchised on his shoulders, Braddock rocketed through the ranks, until this underdog chose to do the unthinkable: take on the heavyweight champ of the world, the unstoppable Max Baer, renowned for having killed two men in the ring."
270,Coach Carter,136,PG-13,2005-01-14,Thomas Carter,"Samuel L. Jackson, Robert Ri'chard, Rick Gonzalez, Nana Gbewonyo, Rob Brown",Controversy surrounds high school basketball coach Ken Carter after he benches his entire team for breaking their academic contract with him.
271,Constantine,120,R,2005-02-18,Francis Lawrence,"Keanu Reeves, Rachel Weisz, Shia LaBeouf, Djimon Hounsou, Max Baker","John Constantine is approached by Det. Angela Dodson who needs his help to prove that her twin sister Isabel's death was not a suicide. The dead woman was a devout Catholic and Angela refuses to accept she would have taken her own life. She's asked Constantine for help because he has a reputation for dealing with the mystical. In fact, he is a demon hunter whose sole purpose on Earth is to send demons back to the nether regions. John himself has been to Hell - as a young man he too committed suicide and now knows that he is destined to return there on his death - but hopes his good deeds may somehow find him a place in Heaven. As he looks into Isabel's death, he realises demons are trying to break through to the human world, and his battles lead him into a direct conflict with Satan."
272,Tim Burton's Corpse Bride,74,PG,2005-09-16,"Tim Burton, Mike Johnson","Johnny Depp, Helena Bonham Carter, Emily Watson, Tracey Ullman, Paul Whitehouse","Set back in the late 1800s in a Victorian village, a man and woman by the names of Victor Van Dort and Victoria Everglot are betrothed because the Everglots need the money or else they'll be living on the streets and the Van Dorts want to be high in society. But when things go wrong at the wedding rehearsal, Victor goes into the woods to practice his vows. Just as soon as he gets them right, he finds himself married to Emily, the corpse bride. While Victoria waits on the other side, there's a rich newcomer that may take Victor's place. So two brides, one groom, who will Victor pick?"
273,Cry Wolf,91,PG-13,2005-09-16,Jeff Wadlow,"Julian Morris, Lindy Booth, Jared Padalecki, Kristy Wu, Jon Bon Jovi","Sandra Demarest arrives at the Caldwell estate, and announces to Mark Caldwell that she was secretly married to his nephew James, who recently died. Mark does not believe her, but allows her to remain at the manor while a search is made for a missing will that would prove her claim. Sandra befriends James' sister, Julie, who tells of strange noises and agonized screams from the laboratory wing of the estate. Between verbal duels with Mark, Sandra secretly investigates the lab and learns that ominous things really are happening."
274,Dark Water,105,PG-13,2005-07-08,Walter Salles,"Jennifer Connelly, John C. Reilly, Tim Roth, Dougray Scott, Pete Postlethwaite","Dahlia Williams and her daughter Cecelia move into a rundown apartment on New York's Roosevelt Island. She is currently in the midst of divorce proceedings and the apartment, though near an excellent school for her daughter, is all she can afford. From the time she arrives, there are mysterious occurrences and there is a constant drip from the ceiling in the only bedroom. There are also noises coming from the apartment directly above hers, though it would appear to be vacant. Is the apartment haunted or is there a simpler explanation?"
275,Darwin's Nightmare,107,Unrated,2005-12-16,Hubert Sauper,,"The larger scope of the story explores the gun trade to Africa that takes place under the covers -- Russian pilots fly guns into Africa, then fly fish back out to Europe. The hazards and consequences of this trade are explored, including the pan-African violence propagated by constant flow of weapons into the continent. If it is a ""survival of the fittest"" world, as Darwin concluded, then the capitalist interests that fund the gun runners are climbing the evolutionary ladder on the backs of the Africans in this stark Darwinian example. Much like the foreseeable extinction of the Lake Victoria perch, and death of Lake Victoria itself, the Africans are in grave jeopardy, even as they survive in the only ways they know how."
276,Demon Hunter,78,R,2005-06-01,Scott Ziehl,"Sean Patrick Flanery, Colleen Porch, Tania Deighton, William H. Bassett, Nancy Yoon","After resolving a situation of exorcism, the half-breed demon hunter Jake Greyman reports to Cardinal White and they realize that the demon Asmodeus is impregnating many mortals trying to raise offspring. Cardinal White calls Sister Sarah Ryan to assist Jake in his hunting for Asmodeus and his women. Meanwhile, Asmodeus sends the delicious and sexy Succubus to seduce Jake. A battle between good and evil is in course."
277,Derailed,107,R,2005-11-11,"Mikael Hafstrom, Addison Timlin","Clive Owen, Jennifer Aniston, Vincent Cassel, Melissa George, Tom Conti","Charles is worn down by his home life where he and his wife struggle to cope with the demands of their daughter's illness and his job. When he meets Lucinda on the train to work in Chicago, there is an immediate spark between them. Soon they are doing lunch; dinner and drinks follow. This leads to an adulterous rendezvous in a hotel. However, no sooner have they torn each other's clothes off than their room is invaded by a thief who beats Charles and rapes Lucinda. Because of the illicit nature of their relationship, Charles agrees with Lucinda who is reluctant to go to the police and soon finds he is powerless to resist the demands of the thief."
278,Deuce Bigalow: European Gigolo,83,R,2005-08-12,"Mike Bigalow, Michael Bigelow","Rob Schneider, Eddie Griffin, Til Schweiger, Douglas Sills, Carlos Ponce","Deuce is tricked again into man-whoring by T.J., only in Amsterdam while other man-whores are being murdered in his midst."
279,Diary of a Mad Black Woman,103,PG-13,2005-02-25,Darren Grant,"Kimberly Elise, Tyler Perry, Shemar Moore, Tamara Taylor, Lisa Marcos",A couple's seemingly solid marriage begins to crumble when the wife discovers that her husband intends to divorce her.
280,Dirty Love,95,R,2005-09-23,John Mallory Asher,"Jenny McCarthy, Carmen Electra, Eddie Kaye Thomas, Kathy Griffin, Kam Heskin",A jilted photographer sets off on a mission to get back at her philandering model boyfriend and along the way discovers that not all love is created equal.
281,Domino,128,R,2005-10-14,Tony Scott,"Keira Knightley, Mickey Rourke, Edgar Ramirez, Rizwan Abbasi, Delroy Lindo","The daughter of an actor father and a social-climber mother, Domino Harvey, bored with her life, decides to join the team of Ed Moseby and becomes a bounty hunter. But she gets in trouble when the Mafia's money is stolen from an armored truck, while Moseby and his crew are participating in a reality show produced by Mark Heiss. The situation gets out of control when the sons of a rival mobster are kidnapped while the FBI is monitoring two gangs of mobsters."
282,Don't Tell,120,R,2005-03-17,Cristina Comencini,"Giovanna Mezzogiorno, Stefania Rocca, Angela Finocchiaro, Alessio Boni, Luigi Lo Cascio","Sabina has a regular life. She is satisfied with her job and her love for Franco. Lately nightmares start disturbing her, and almost in the same time she discovers to be pregnant. Step by step she remembers her childhood spent within a severe middle-class family. But a big secret is hidden within her heart. Sabina wants to contact again her brother, a University teacher in the US, to try to understand what is happened in their past. What is the secret? She is determined to bring clarity and serenity in her life. She finally manages to free herself from her ""beast inside the heart""."
283,Doom,104,R,2005-10-21,Andrzej Bartkowiak,"Dwayne Johnson, Karl Urban, Rosamund Pike, Razaaq Adoti, Deobia Oparei",Something has gone wrong at a remote scientific research station on Mars. All research has ceased. Communication has failed. And the messages that do get through are less than comforting. It's a level 5 quarantine and the only souls allowed in or out are the Rapid Response Tactical Squad - hardened Marines armed to the teeth with enough firepower to neutralize the enemy...or so they think.
284,Dragon Squad (Maang lung),110,Unrated,2005-11-10,Daniel Lee,"Shawn Yue, Yu Xia, Eva Huang, Lawrence Chou, Sammo Hung Kam-Bo","A team of young Interpol agents arrive in Hong Kong to give testimony at the trial of local crime lord 'Puma' Duen. Among them are American agent Andy Hui, Taiwanese cop Vanness Chang, and local lawman Lok. They are greeted by Hong Kong police commander Hon Sun. The heavily armed convoy taking Puma to court is attacked by a ruthless team of North Korean agents, led by international terrorist Petros Davinci. Petros is seeking revenge for his brother in arms, who was killed by Puma and his brother, 'Tiger' Duen. At Petros' side is his fierce enforcer, Ko, and a lethal lady sniper, Song. After Puma is snatched, the Interpol team insists on tracking down Petros themselves. Hon Sun rejects their request and places the team in the care of veteran police officer Kong Long. A burned out cop who has never come to terms with either his personal or professional history, Long Kong is reluctant to get involved. Finally, inspired by his young charges, he rises to the occasion, and leads the ..."
285,Dreamer: Inspired by a True Story,98,PG,2005-10-21,John Gatins,"Kurt Russell, Dakota Fanning, Kris Kristofferson, Elisabeth Shue, Luis Guzman","Ben Crane believes that a severely injured racehorse deserves another chance. He and his daughter Cale adopt the horse (in fact is a mare)and save it of being sacrificed by the owner. The arrival of the mare to Crane's farm, will be the perfect opportunity for both father and daughter to reconstruct their lost familiar bond. ""Soñador"" (Dreamer in English), the renamed mare, despite its broken leg, maybe could have another chance to return to the racecourse, with the help of Cale, Ben, and his father, Pop."
286,Elektra,98,PG-13,2005-01-14,Rob Bowman,"Jennifer Garner, Goran Visnjic, Kirsten Prout, Will Yun Lee, Cary-Hiroyuki Tagawa","In the ultimate battle between good and evil stands a warrior who makes the choice that tips the balance. A strong, mysterious and a deadly sexy action heroine - a lethal synthesis of grace and power. Not long after recovering from seemingly mortal wounds, Elektra has severed all ties with the world, living only for her next assignment. But in an unexpected turn of events, she is forced to make a decision that can take her life in a new direction - or destroy her. Key players in Elektra's journey are Stick, a blind martial arts master responsible for Elektra's ""resurrection,"" and Mark Miller and Abby Miller, a father and daughter on the run from The Hand, a powerful syndicate whose members practice the dark version of the martial art Kimagure."
287,Elizabethtown,123,PG-13,2005-10-14,Cameron Crowe,"Orlando Bloom, Kirsten Dunst, Susan Sarandon, Alec Baldwin, Bruce McGill","After causing a loss of almost one billion dollars in his company, the shoe designer Drew Baylor decides to commit suicide. However, in the exact moment of his act of despair, he receives a phone call from his sister telling him that his beloved father had just died in Elizabethtown, and he should bring him back since his mother had problem with the relatives of his father. He travels in an empty red eye flight and meets the attendant Claire Colburn, who changes his view and perspective of life."
288,Enron: The Smartest Guys in the Room,110,R,2005-04-29,Alex Gibney,"Peter Coyote, Amanda Martin-Brock, Andrew Fastow, Bethany McLean","Enron dives from the seventh largest US company to bankruptcy in less than a year in this tale told chronologically. The emphasis is on human drama, from suicide to 20,000 people sacked: the personalities of Ken Lay (with Falwellesque rectitude), Jeff Skilling (he of big ideas), Lou Pai (gone with $250 M), and Andy Fastow (the dark prince) dominate. Along the way, we watch Enron game California's deregulated electricity market, get a free pass from Arthur Andersen (which okays the dubious mark-to-market accounting), use greed to manipulate banks and brokerages (Merrill Lynch fires the analyst who questions Enron's rise), and hear from both Presidents Bush what great guys these are."
289,Fantastic Four (2005),123,PG-13,2005-07-08,Tim Story,"Ioan Gruffudd, Jessica Alba, Chris Evans, Michael Chiklis, Julian McMahon","Reed Richards, a brilliant but timid and bankrupt scientist, is convinced that evolution can be triggered by clouds of cosmic energy, and has calculated that Earth is going to pass one of these clouds soon. Together with his friend and partner, the gruff yet gentle astronaut muscle-man Ben Grimm, Reed convinces his conceited MIT classmate Dr. Victor Von Doom, now CEO of his own enterprise, to allow him access to his privately-owned space station. Von Doom agrees in exchange for control over the experiment and a majority of the profits from whatever benefits it brings. He thus brings aboard Susan Storm, his shy, though assertive chief genetics researcher and a former lover of Reed's with whom she had an acrimonious break-up, and her diametrically opposed brother Johnny, the maverick and hot-headed playboy pilot. The astronauts make it home intact; however, before long they begin to mutate, developing strange and amazing powers as a result of their exposure to the cloud! Reed is able to..."
290,Fever Pitch,98,PG-13,2005-04-08,"Bobby Farrelly, Peter Farrelly","Drew Barrymore, Jimmy Fallon, Jason Spevack, Jack Kehler, Scott H. Severance",Lindsay is stuck in the middle of her relationship with Ben and his passion for the Boston Red Sox.
291,Flightplan,98,PG-13,2005-09-23,Robert Schwentke,"Jodie Foster, Sean Bean, Kate Beahan, Michael Irby, Peter Sarsgaard","The husband of aviation engineer Kyle Pratt has just died in Berlin. Now she is flying back to New York with his coffin and their six-year-old daughter Julia. Three hours into the flight Kyle awakens to find that Julia is gone! It's a big double-decker plane, so very concerned mother has a lot of territory to cover in order to find her daughter. But as Kyle fights to discern the truth, she takes matters into her own hands."
