,title,runtime,mpaa_rating,theatrical_release,director,actor,plot
0,127 Hours,94,R,2010-11-05,Danny Boyle,"James Franco, Amber Tamblyn, Kate Mara, Kate Burton, Lizzy Caplan","An adventurous mountain climber becomes trapped under a boulder while canyoneering alone near Moab, Utah and resorts to desperate measures in order to survive."
1,8: The Mormon Proposition,78,R,2010-06-18,"Reed Cowan, Steven Greenstreet","Dustin Lance Black, Gavin Newsom, Hal Sparks, Tyler Barrick, Kate Kendell","In 2009, thousands of LGBT citizens are denied almost 200 civil rights their straight, married counterparts enjoy through civil marriage. Some states have signaled progress. But amid the progress, The Mormon Church, with its front-group THE NATIONAL ORGANIZATION FOR MARRIAGE, has been coordinating, financing and leading the effort to stop the advancement of marriage equality for more than three decades. As an organization worth hundreds of billions of dollars, the Mormon Church has been able to wage this war in secret. Not until the California Fair Political Practices Commission launched an investigation into the Mormon's involvement in Proposition 8, did the secrets of the Mormon effort become a matter of record. Through never-before seen documents, recordings & insider-interviews, 8: THE MORMON PROPOSITION, exposes the efforts of the Mormon Church and its members to halt nearly every piece of LGBT legislation on the desks of lawmakers from Hawaii to New York. 8: THE MORMON PROPOSITION makes these efforts a matter of record and challenges viewers to demand more of government officials in requiring religions more transparency in their efforts to influence public policy. Emmy-award winning journalist and documentary filmmaker Reed Cowan is a former Mormon who served a two-year mission door-to-door for the Mormon Church. His access to high-level Mormons & Mormon communications on the matter, coupled with his OUT status as a gay man and father of two adopted sons has provided a compelling and at times shocking look at the Mormon way of doing business against LGBT people."
2,A Nightmare on Elm Street,96,R,2010-04-30,Samuel Bayer,"Rooney Mara, Kyle Gallner, Thomas Dekker, Jackie Earle Haley, Katie Cassidy","Several people are hunted by a cruel serial killer who kills his victims in their dreams. While the survivors are trying to find the reason for being chosen, the murderer won't lose any chance to kill them as soon as they fall asleep."
3,A Prophet (Un prophete),155,R,2010-02-26,Jacques Audiard,"Tahar Rahim, Niels Arestrup, Adel Bencherif, Reda Kateb, Hichem Yacoubi","Nineteen year-old Franco-Arab Malik El Djebena is just starting his six year prison sentence in Brécourt. Although he has spent the better part of his life in juvenile detention, this stint is his first in an adult prison. Beyond the division of Corsicans and Muslims in the prison (the Corsicans who with their guard connections rule what happens in the prison), he has no known friends or enemies inside. He is just hoping to serve his time in peace and without incident, despite having no prospects once he's out of jail since he's illiterate and has no support outside of the prison. Due to logistics, the head of Corsican inmates, a sadistic mafioso named César Luciani, co-opts Malik as part of the Corsicans' activities, not only regarding what happens inside the prison, but also continued criminal activities outside. The innocent Malik has no idea what to do but cooperate. This move does not sit well with the other Corsicans, who only see Malik as a dirty Arab, and the Muslims who now"
4,Alice in Wonderland,108,PG,2010-03-05,Tim Burton,"Johnny Depp, Mia Wasikowska, Helena Bonham Carter, Anne Hathaway, Matt Lucas","Alice, an unpretentious and individual 19-year-old, is betrothed to a dunce of an English nobleman. At her engagement party, she escapes the crowd to consider whether to go through with the marriage and falls down a hole in the garden after spotting an unusual rabbit. Arriving in a strange and surreal place called ""Underland,"" she finds herself in a world that resembles the nightmares she had as a child, filled with talking animals, villainous queens and knights, and frumious bandersnatches. Alice realizes that she is there for a reason--to conquer the horrific Jabberwocky and restore the rightful queen to her throne."
5,Animal Kingdom,112,R,2010-08-13,David Michod,"Ben Mendelsohn, Joel Edgerton, Guy Pearce, Luke Ford, Jacki Weaver","Despite being no saint herself, Julia Cody has shielded her seventeen year old son, Joshua ""J"" Cody, from her Melbourne-based criminal relatives who they have not seen in years. After Julia dies in front of J's eyes from a self-inflicted heroin overdose, J, who is slightly detached from life, feels he has no choice but to contact his maternal grandmother, Janine ""Smurf"" Cody, the family matriarch, for a place to live. Smurf rules the family with a borderline incestuous love over her three sons, the quietly menacing Andrew ""Pope"" Cody, the hyperactive Craig Cody, and the barely of age Darren Cody. Pope and his best friend, Barry ""Baz"" Brown, are armed robbers, with Darren their up and coming apprentice, while Craig is a mid level drug dealer. Melbourne's Armed Robbery Squad is after specifically Pope, who is hiding out. But when the standoff between the Codys and the Armed Robbery Squad is brought up a notch, an all out war ensues, with some casualties and J caught in the middle. The only grounding in J's life is his girlfriend, Nicky Henry. With those casualties comes an investigation by Homicide Detective Senior Sergeant Nathan Leckie, who knows the Codys are involved in some of those deaths. As Leckie tries to get J on his side, J has to figure out how best to get himself out from the middle, where he trusts neither side. J also wants to figure out how to exact what he considers justice in an all around bad situation."
6,Another Year,129,PG-13,2010-12-29,Mike Leigh,"Jim Broadbent, Ruth Sheen, Lesley Manville, Oliver Maltman, Peter Wight","A married couple who have managed to remain blissfully happy into their autumn years, are surrounded over the course of the four seasons of one average year by friends, colleagues, and family who all seem to suffer some degree of unhappiness."
7,The Last Airbender,103,PG,2010-07-01,M. Night Shyamalan,"Noah Ringer, Dev Patel, Nicola Peltz, Jackson Rathbone, Jessica Jade Andres","Follows the adventures of Aang, a young successor to a long line of Avatars, who must master all four elements and stop the Fire Nation from enslaving the Water Tribes and the Earth Kingdom."
8,Biutiful,148,R,2010-12-29,Alejandro Gonzalez Inarritu,"Javier Bardem, Maricel Alvarez, Eduard Fernandez, Diaryatou Daff, Luo Jin","This is the story of Uxbal, a man living in this world, but able to see his death, which guides his every move."
9,Black Swan,108,R,2010-12-03,Darren Aronofsky,"Natalie Portman, Mila Kunis, Vincent Cassel, Barbara Hershey, Winona Ryder","A committed dancer wins the lead role in a production of Tchaikovsky's ""Swan Lake"" only to find herself struggling to maintain her sanity."
10,Blue Valentine,114,R,2010-12-29,"Andrij Parekh, Derek Cianfrance","Ryan Gosling, Michelle Williams, Faith Wladyka, John Doman, Mike Vogel","Dean Pereira and Cindy Heller Pereira are a young, working class married couple - Dean currently working as a painter, and Cindy working as a nurse in a medical clinic - with a young daughter named Frankie. Despite their relatively tender ages, they are both ravaged by the life they've eked out together and by the experiences they've had leading into their marriage. Dean, a high school drop out, comes from a broken home, where he never really had a mother figure. He never saw himself getting married or having a family despite falling in love at first sight with Cindy. He doesn't have any professional ambition beyond his current work - which he enjoys since he feels he can knock off a beer at 8 o'clock in the morning without it affecting his work - although Cindy believes he has so much more potential in life. Cindy also comes from a dysfunctional family, with her own mother and father not setting an example of a harmonious married or family life. One of her previous serious relationships was with Bobby Ontario, that relationship which has a profound affect on many aspects of her marriage to Dean. Dean and Cindy head off on an overnight getaway together without Frankie, the getaway which may provide a clearer picture if their marriage can survive its many issues."
11,Boogie Woogie,90,R,2010-04-23,Duncan Ward,"Gillian Anderson, Alan Cumming, Heather Graham, Danny Huston, Jack Huston","In London's contemporary art world, everyone has a hustle. Art Spindle runs a high-end gallery: he hopes to flip a Mondrian for millions. One of his assistants, Beth, is sleeping with Art's most acquisitive client, Bob Macclestone. Beth wants Bob to set her up in her own gallery, so she helps him go behind Art's back for the Mondrian. Bob's wife, Jean, sets her eye on a young conceptual artist, Jo, who lusts after Art's newest assistant, Paige. Meanwhile, self-absorbed lesbian videographer Elaine is chewing her way through friends and lovers looking to make it: if she'll throw Dewey, her agent, under the bus, Beth may give her a show. And the Mondrian? No honor among thieves."
12,Brooklyn's Finest,133,R,2010-03-05,Antoine Fuqua,"Richard Gere, Don Cheadle, Ethan Hawke, Wesley Snipes, Will Patton","In Brooklyn, amid drug deals, violence, casual racism, poverty, housing projects, and corrupt cops, we follow three officers: Tango, African-American, working undercover, believing he's earned a promotion to a desk job but told he has to set up the bust of an ex-con who saved his life; Sal, who'll commit murder to get cash; and, Eddie, the precinct's oldest beat cop, a week to go before retirement, assigned to mentor an earnest rookie. Can this end well for any of the three?"
13,Buried,95,R,2010-09-24,Rodrigo Cortes,"Ryan Reynolds, Ivana Mino, Jose Luis Garcia Perez, Robert Paterson",Paul is a U.S. truck driver working in Iraq. After an attack by a group of Iraqis he wakes to find he is buried alive inside a coffin. With only a lighter and a cell phone it's a race against time to escape this claustrophobic death trap.
14,Cairo Time,88,PG,2010-08-06,Ruba Nadda,"Patricia Clarkson, Alexander Siddig, Elena Anaya, Amina Annabi, Tom McCamus","In Cairo on her own as she waits for her husband, Juliette finds herself caught in a whirlwind romance with his friend Tareq, a retired cop. As Tareq escorts Juliette around the city, they find themselves in the middle of a brief affair that catches them both unawares."
15,Carlos,333,Unrated,2010-10-15,Olivier Assayas,"Edgar Ramirez, Alexander Scheer, Nora von Waldstatten, Ahmad Kaabour, Christoph Bach","Ilich Ramirez Sanchez, aka 'Carlos,' is a Venezuelan-born Marxist revolutionary who aligns himself with the Palestinian cause and becomes the world's most notorious terrorist. He leads assaults on the meeting of OPEC ministers, taking them hostage and flying them from country to country seeking asylum, one of the most daring acts of terrorism in history. From his earliest days as an apprentice in the revolutionary movement to his subsequent downfall, Carlos becomes a figure of legend."
16,Casino Jack,108,R,2010-12-17,George Hickenlooper,"Kevin Spacey, Barry Pepper, Jon Lovitz, Kelly Preston, Rachelle Lefevre",A hot shot Washington DC lobbyist and his protégé go down hard as their schemes to peddle influence lead to corruption and murder.
17,Centurion,97,R,2010-08-27,Neil Marshall,"Michael Fassbender, Dominic West, Olga Kurylenko, Noel Clarke, David Morrissey","Britain, A.D. 117. Quintus Dias, the sole survivor of a Pictish raid on a Roman frontier fort, marches north with General Virilus' legendary Ninth Legion, under orders to wipe the Picts from the face of the Earth and destroy their leader, Gorlacon."
18,Charlie St. Cloud,98,PG-13,2010-07-30,Burr Steers,"Zac Efron, Charlie Tahan, Amanda Crew, Augustus Prew, Donal Logue","Charlie's brother, Sam, dies in a car crash that Charlie survives. Charlie is given the gift of seeing his dead brother, but when the girl he falls in love with's life is at risk, he must choose between his girlfriend and his brother."
19,Chloe,99,R,2010-03-26,Atom Egoyan,"Liam Neeson, Julianne Moore, Amanda Seyfried, Nina Dobrev, R.H. Thomson","Catherine and David, she a doctor, he a professor, are at first glance the perfect couple. Happily married with a talented teenage son, they appear to have an idyllic life. But when David misses a flight and his surprise birthday party, Catherine's long simmering suspicions rise to the surface. Suspecting infidelity, she decides to hire an escort to seduce her husband and test his loyalty. Catherine finds herself 'directing' Chloe's encounters with David, and Chloe's end of the bargain is to report back, the descriptions becoming increasingly graphic as the meetings multiply."
20,Conviction,107,R,2010-10-15,Tony Goldwyn,"Hilary Swank, Sam Rockwell, Minnie Driver, Melissa Leo, Peter Gallagher","Betty Anne Waters (Swank) is a high school dropout who spent nearly two decades working as a single mother while putting herself through law school, tirelessly trying to beat the system and overturn her brother's (Rockwell) unjust murder conviction."
21,Devil,80,PG-13,2010-09-17,John Erick Dowdle,"Chris Messina, Geoffrey Arend, Bokeem Woodbine, Caroline Dhavernas, Jenny O'Hara","In Philadelphia, Detective Bowden is still grieving for his wife and son, killed in a hit-and-run five years ago. When someone jumps from a skyscraper onto a truck, Bowden is sent to investigate. Meanwhile, five strangers are trapped in an elevator in the building where the jumper committed suicide. The communication radio in the elevator is broken but the guards, Lustig and Ramirez, observe the individuals via CCTV as events unfold. Tensions run high among those trapped, so Lustig calls the police and Detective Bowden assumes the case. Without being able to contact the individuals, he tries to work out who they are, but he can only account for four of them. Time is running out for the occupants of the elevator, as Bowden realizes he has to get them out quickly."
22,Diary of a Wimpy Kid,93,PG,2010-03-19,Thor Freudenthal,"Zachary Gordon, Robert Capron, Rachael Harris, Steve Zahn, Connor Fielding","The adventures of a teenager who is fresh out and in Middle School, where he has to learn the consequences and responsibility to survive the year."
23,Dinner for Schmucks,114,PG-13,2010-07-30,Jay Roach,"Steve Carell, Paul Rudd, Zach Galifianakis, Jemaine Clement","When he finds out that his work superiors host a dinner celebrating the idiocy of their guests, a rising executive questions it when he's invited, just as he befriends a man who would be the perfect guest."
24,Don McKay,87,R,2010-04-02,Jake Goldberger,"Thomas Haden Church, Elisabeth Shue, Melissa Leo, M. Emmet Walsh, Keith David","Don McKay, a high school janitor who leaves his hometown after a tragedy, returns 25 years later to rekindle a romance with his old flame, who is dying, but this homecoming brings McKay more than he bargained for."
25,Exit Through The Gift Shop,86,R,2010-04-16,Banksy,"Banksy, Rhys Ifans, Thierry Guetta, Shepard Fairey, Space Invader","The story of how an eccentric French shop-keeper and amateur film-maker attempted to locate and befriend Banksy, only to have the artist turn the camera back on its owner. The film contains footage of Banksy, Shephard Fairey, Invader and many of the world's most infamous graffiti artists at work."
26,Fair Game,108,PG-13,2010-11-05,Doug Liman,"Naomi Watts, Sean Penn, Bruce McGill, Michael Kelly, Ty Burrell",Plame's status as a CIA agent was revealed by White House officials allegedly out to discredit her husband after he wrote a 2003 New York Times op-ed piece saying that the Bush administration had manipulated intelligence about weapons of mass destruction to justify the invasion of Iraq.
27,Faster,98,R,2010-11-24,George Tillman Jr.,"Billy Bob Thornton, Oliver Jackson-Cohen, Carla Gugino, Maggie Grace, Moon Bloodgood","A lone man, recently released from prison, seeks out the people from his past who he believes betrayed him. While he forces each to atone for their sins, he must also face what meting out vengeance will do to his immortal soul. Meanwhile, he's not the only one looking to settle old scores. Hired by the man responsible for the events which lead him to prison, an eccentric contract killer follows his every move. Scenes of them crossing paths, sometimes violently, are interspersed with the assassin's self-realizations of how to deal with struggles within his own life. As if old enemies & hired guns aren't enough, a young female detective begrudgingly works alongside a veteran investigator looking to simply survive his last two weeks on the force before retirement, as they seek out the brazen ex-con who has been blazing a path of gasoline-powered destruction in his vintage Chevelle."
28,Fish Tank,124,Unrated,2010-01-15,Andrea Arnold,"Katie Jarvis, Michael Fassbender, Rebecca Griffiths, Sydney Mary Nash, Harry Treadaway","Mia, an aggressive fifteen-year-old girl, lives on an Essex estate with her tarty mother, Joanne, and precocious little sister Tyler. She has been thrown out of school and is awaiting admission to a referrals unit and spends her days aimlessly. She begins an uneasy friendship with Joanne's slick boyfriend, Connor, who encourages her one interest, dancing."
29,For Colored Girls,134,R,2010-11-05,Tyler Perry,"Kimberly Elise, Janet Jackson, Loretta Devine, Thandie Newton, Anika Noni Rose","The movie is based on Ntozake Shange's play ""For Colored Girls Who Have Considered Suicide When the Rainbow Is Enuf."" Unlike the original play which featured only 7 women known by colors performing the collection of 20 poems, the movie has given each of the 20 characters names. Each of the poems deal with intense issues that particularly impact women in a thought-provoking commentary on what it means to be a female of color in the world."
30,From Paris with Love,92,R,2010-02-05,Pierre Morel,"John Travolta, Jonathan Rhys Meyers, Kasia Smutniak, Amber Rose Revah, Richard Durden","James Reece is an ambitious aide to the U.S. Ambassador in Paris, doing little jobs for the CIA and hoping to get into black ops. On the night he and his girlfriend, Caroline, become engaged, he's told to pick up Charlie Wax at Orly. Charlie is an unorthodox government employee - large, bald and bearded, foul-mouthed and eccentric. Charlie immediately takes James on a wild ride of murder and mayhem, through ethnic enclaves. As bodies pile up, the purpose remains opaque to James. Caroline, unhappy that James has been out of touch for a day, tells him to bring Charlie for dinner. Charlie can be charming - where will it lead? Does the chess-playing James have what it takes?"
31,Frozen (2010),93,R,2010-02-05,Adam Green,"Emma Bell, Shawn Ashmore, Kevin Zegers","At Mount Holliston, snowboarders Dan Walker, his girlfriend Parker O'Neil and his best friend Joe Lynch don't have enough money to buy lift tickets. Parker bribes Jason, a lift-worker, with one hundred dollars. When the system is nearing closure, they force Jason to let them have one last pass. However, Jason needs to resolve a problem and his colleague misunderstands his instructions and stops the lift. The trio of skier and snowboarders gets stranded on the chairlift near the top of the mountain. When they see that the lights of the ski resort had been turned off, they need to make a choice: leave the chairlift or freeze to death."
32,Greenberg,100,R,2010-03-26,Noah Baumbach,"Ben Stiller, Rhys Ifans, Greta Gerwig, Jennifer Jason Leigh, Brie Larson","A man from Los Angeles, who moved to New York years ago, returns to L.A. to figure out his life while he house-sits for his brother. He soon sparks with his brother's assistant."
33,Guy and Madeline on a Park Bench,82,Unrated,2010-11-05,Damien Chazelle,"Jason Palmer, Desiree Garcia, Sandha Khin, Frank Garvin, Andre Hayward","After connecting with the shy Madeline, a jazz trumpeter embarks on a quest for a more gregarious paramour, but through a series of twists and turns punctuated by an original score, the two lovers seem destined to be together."
34,Harry Brown,103,R,2010-04-30,Daniel Barber,"Michael Caine, Emily Mortimer, Charlie Creed-Miles, David Bradley, Iain Glen",An elderly ex-serviceman and widower looks to avenge his best friend's murder by doling out his own form of justice.
35,Harry Potter and the Deathly Hallows - Part 1,146,PG-13,2010-11-19,David Yates,"Daniel Radcliffe, Emma Watson, Rupert Grint, Helena Bonham Carter, Ralph Fiennes","Voldemort's power is growing stronger. He now has control over the Ministry of Magic and Hogwarts. Harry, Ron, and Hermione decide to finish Dumbledore's work and find the rest of the Horcruxes to defeat the Dark Lord. But little hope remains for the Trio, and the rest of the Wizarding World, so everything they do must go as planned."
36,Hereafter,126,PG-13,2010-10-22,Clint Eastwood,"Matt Damon, Bryce Dallas Howard, Jay Mohr, Richard Kind, Frankie McLaren","A drama centered on three people who are haunted by mortality in different ways. George (Matt Damon) is a blue-collar American who has a special connection to the afterlife. On the other side of the world, Marie (Cécile De France), a French journalist, has a near-death experience that shakes her reality. And when Marcus (Identical twins Frankie McLaren) and George McLaren), a London schoolboy, loses the person closest to him, he desperately needs answers. Each on a path in search of the truth, their lives will intersect, forever changed by what they believe might-or must-exist in the hereafter."
37,How to Train Your Dragon,98,PG,2010-03-26,"Dean DeBlois, Chris Sanders","Jay Baruchel, Gerard Butler, Craig Ferguson, America Ferrera, Jonah Hill","Long ago up North on the Island of Berk, the young Viking, Hiccup, wants to join his town's fight against the dragons that continually raid their town. However, his macho father and village leader, Stoik the Vast, will not allow his small, clumsy, but inventive son to do so. Regardless, Hiccup ventures out into battle and downs a mysterious Night Fury dragon with his invention, but can't bring himself to kill it. Instead, Hiccup and the dragon, whom he dubs Toothless, begin a friendship that would open up both their worlds as the observant boy learns that his people have misjudged the species. But even as the two each take flight in their own way, they find that they must fight the destructive ignorance plaguing their world."
38,I Am Love,120,R,2010-06-18,Luca Guadagnino,"Tilda Swinton, Flavio Parenti, Edoardo Gabbriellini, Alba Rohrwacher, Chiara Tomarelli","Emma left Russia to live with her husband in Italy. Now a member of a powerful industrial family, she is the respected mother of three, but feels unfulfilled. One day, Antonio, a talented chef and her son's friend, makes her senses kindle."
39,I Love You Phillip Morris,98,R,2010-12-03,"John Requa, Glenn Ficarra","Jim Carrey, Ewan McGregor, Leslie Mann, Antoni Corone, Rodrigo Santoro","Steven Russell is happily married to Debbie, and a member of the local police force when a car accident provokes a dramatic reassessment of his life. Steven becomes open about his homosexuality and decides to live life to the fullest - even if it means breaking the law. Steven's new, extravagant lifestyle involves cons and fraud and, eventually, a stay in the State Penitentiary where he meets sensitive, soft-spoken Phillip Morris. His devotion to freeing Phillip from jail and building the perfect life together prompts Steven to attempt and often succeed at one impossible con after another."
40,I Spit On Your Grave,108,R,2010-10-08,Steven R. Monroe,"Sarah Butler, Jeff Branson, Andrew Howard, Daniel Franzese, Rodney Eastman","Writer Jennifer Hills (Butler) takes a retreat from the city to a charming cabin in the woods to start on her next book. But Jennifer's presence in the small town attracts the attention of a few morally depraved locals who set out one night to teach this city girl a lesson. They break into her cabin to scare her. However, what starts out as terrifying acts of humiliation and intimidation, quickly and uncontrollably escalates into a night of physical abuse and torturous assault. But before they can kill her, Jennifer sacrifices her broken and beaten body to a raging river that washes her away. As time passes, the men slowly stop searching for her body and try to go back to life as usual. But that isn't about to happen. Against all odds, Jennifer Hills survived her ordeal. Now, with hell bent vengeance, Jennifer's sole purpose is to turn the tables on these animals and to inflict upon them every horrifying and torturous moment they carried out on her... only much, much worse."
