,title,runtime,mpaa_rating,theatrical_release,director,actor,plot
501,Let's Go to Prison,90,R,2006-11-17,Bob Odenkirk,"Dax Shepard, Will Arnett, Chi McBride, David Koechner, Dylan Baker","John Lyshitski is a car stealing slacker, with a weed problem, and has been in Illinois' Rossmore State Penitentiary so many times, he knows its entire population of both staff and cons by their first names. Cursed with the old ill luck of being in the wrong place, at the wrong time, in possession of the wrong car, he's been deemed a lost cause repeat offender in the eyes of everyone else. When the heartless judge, who has been behind most of his sentences, goes to the big court house in the sky, John decides to ruin the man's legacy by having the judge's only offspring, Nelson Biederman IV, thrown in the slammer along with him. Here, the world-class selfish jerk learns a certain old lesson the hard way: Do unto others as you would have others do unto you. But has John gone too far in the payback department?"
502,Letters from Iwo Jima,142,R,2006-12-20,Clint Eastwood,"Ken Watanabe, Kazunari Ninomiya, Tsuyoshi Ihara, Nae Yuuki, Shido Nakamura","The island of Iwo Jima stands between the American military force and the home islands of Japan. Therefore the Imperial Japanese Army is desperate to prevent it from falling into American hands and providing a launching point for an invasion of Japan. General Tadamichi Kuribayashi is given command of the forces on the island and sets out to prepare for the imminent attack. General Kuribayashi, however, does not favor the rigid traditional approach recommended by his subordinates, and resentment and resistance fester among his staff. In the lower echelons, a young soldier, Saigo, a poor baker in civilian life, strives with his friends to survive the harsh regime of the Japanese army itself, all the while knowing that a fierce battle looms. When the American invasion begins, both Kuribayashi and Saigo find strength, honor, courage, and horrors beyond imagination."
503,Little Children,136,R,2006-10-06,Todd Field,"Kate Winslet, Patrick Wilson, Jennifer Connelly, Jackie Earle Haley, Gregg Edelman","Echoes of ""Madame Bovary"" in the American suburbs. Sarah's in a loveless marriage to an advertising executive, long days with her young daughter at the park and the pool, wanting more. Brad is an immature househusband, married to a flinty documentary filmmaker. Ronnie is just out of prison - two years for indecent exposure to a minor - living with his elderly mother, May; Larry is a retired cop, fixated on driving Ronnie away. Sarah and Brad connect, a respite of adult companionship at the pool. Ronnie and Larry have their demons. Brad should be studying for the bar; Larry misses his job; Ronnie's mom thinks he needs a girlfriend. Sarah longs to refuse to be trapped in an unhappy life. Where can these tangled paths lead?"
504,Little Man,90,PG-13,2006-07-14,Keenen Ivory Wayans,"Marlon Wayans, Shawn Wayans, Kerry Washington, John Witherspoon, Tracy Morgan","After leaving the prison, the dwarf criminal Calvin Sims joins to his moron brother Percy to steal an expensive huge diamond in a jewelry for the mobster Walken. They are chased by the police, and Calvin hides the stone in the purse of the executive Vanessa Edwards, whose husband Darryl Edwards wants to have a baby. Percy convinces Calvin to dress like a baby and be left in front of the Edwards's house to get inside the house and retrieve the diamond. Darryl and Vanessa keep Calvin for the weekend and decide to adopt him, while Walken threatens Darryl to get the stone back."
505,Little Miss Sunshine,110,R,2006-07-26,"Jonathan Dayton, Valerie Faris","Greg Kinnear, Toni Collette, Steve Carell, Paul Dano, Abigail Breslin",A family determined to get their young daughter into the finals of a beauty pageant take a cross-country trip in their VW bus.
506,Lucky Number Slevin,110,R,2006-04-07,Paul McGuigan,"Josh Hartnett, Morgan Freeman, Ben Kingsley, Lucy Liu, Stanley Tucci","In an airport waiting room, a man in a wheelchair tells a stranger a story about a fixed horse race in 1979 that resulted in a family's deaths. In Manhattan, two bookies and the son of a Mob boss die. A young man just out of the shower answers the door to a neighbor woman and explains that he's visiting, has had a bad week, including being mugged, and doesn't know where his pal, who lives there, is. The neighbor is chatty; she's a coroner. Two thugs arrive and, believing the visitor to be the guy who lives there, take him to see the boss with the dead son, who tells him to kill the son of his Mob rival. Mistaken identity? What connects the threads? Cops are watching."
507,Madea's Family Reunion,107,PG-13,2006-02-24,Tyler Perry,"Tyler Perry, Lynn Whitfield, Blair Underwood, Boris Kodjoe, Maya Angelou","While planning her family reunion, a pistol-packing grandma must contend with the other dramas on her plate, including the runaway who has been placed under her care, and her love-troubled nieces."
508,Man of the Year,115,PG,2006-10-13,Barry Levinson,"Robin Williams, Christopher Walken, Laura Linney, Jeff Goldblum, Lewis Black","Tom Dobbs, comedic host of a political talk show - a la Bill Maher and Jon Stewart - runs for President of the US as an independent candidate who, after an issues-oriented campaign and an explosive performance in the final debate, gets just enough votes to win. Trouble is he owes his victory to a computer glitch in the national touch-screen voting system marketed by Delacroy, a private company with a rising stock price. To protect their fortune, Delacroy executives want to keep the glitch a secret, but one programmer, Eleanor Green, wants Dobbs to know the truth. Can she get to him?"
509,Marie Antoinette,123,PG-13,2006-10-20,Sofia Coppola,"Kirsten Dunst, Jason Schwartzman, Judy Davis, Rip Torn, Asia Argento","The retelling of France's iconic but ill-fated queen, Marie Antoinette. From her betrothal and marriage to Louis XVI at 15 to her reign as queen at 19 and to the end of her reign as queen and ultimately the fall of Versailles."
510,Material Girls,98,PG,2006-08-18,Martha Coolidge,"Hilary Duff, Haylie Duff, Anjelica Huston, Lukas Haas, Maria Conchita Alonso","Two wealthy sisters, both heiresses to their family's cosmetics fortune, are given a wake-up call when a scandal and ensuing investigation strip them of their wealth."
511,Miami Vice,132,R,2006-07-28,Michael Mann,"Colin Farrell, Jamie Foxx, Li Gong, Naomie Harris, Ciaran Hinds","Ricardo Tubbs is urbane and dead smart. He lives with Bronx-born Intel analyst Trudy, as they work undercover transporting drug loads into South Florida to identify a group responsible for three murders. Sonny Crockett [to the untrained eye, his presentation may seem unorthodox, but procedurally, he is sound] is charismatic and flirtatious until - while undercover working with the supplier of the South Florida group - he gets romantically entangled with Isabella, the Chinese-Cuban wife of an arms and drugs trafficker. The best undercover identity is oneself with the volume turned up and restraint unplugged. The intensity of the case pushes Crockett and Tubbs out onto the edge where identity and fabrication become blurred, where cop and player become one - especially for Crockett in his romance with Isabella and for Tubbs in the provocation of an assault on those he loves."
512,Mission: Impossible III,127,PG-13,2006-05-05,J.J. Abrams,"Philip Seymour Hoffman, Ving Rhames, Billy Crudup, Michelle Monaghan, Tom Cruise",Agent Ethan Hunt comes into conflict with a dangerous and sadistic arms dealer who threatens his life and his fianceé in response .
513,Monster House,91,PG,2006-07-21,Gil Kenan,"Steve Buscemi, Nick Cannon, Maggie Gyllenhaal, Jon Heder, Kevin James","Three teens discover that their neighbor's house is really a living, breathing, scary monster."
514,"My Country, My Country",90,Unrated,2006-08-04,Laura Poitras,"Carlos Valenzuela, Riyadh Al-Adhadh, Peter Towndrow, Khris Scarcliff",Documentary by Oscar winner Laura Poitras about the war in Iraq.
515,My Super Ex-Girlfriend,95,PG-13,2006-07-21,Ivan Reitman,"Uma Thurman, Luke Wilson, Anna Faris, Eddie Izzard, Rainn Wilson","In New York, when the shy and lonely project manager of a design firm Matt Saunders meets Jenny Johnson in the subway, he invites her to date and have dinner with him. Jenny immediately falls in love for him, they have sex and she discloses her true identity to him, telling that she is the powerful superhero G-Girl. After meeting his co-worker and friend Hannah Lewis, the needy Jenny becomes jealous, controlling and manipulative, and Matt follows the advice of his best friend Vaughn Haige and dumps her, breaking her heart. Jenny turns Matt's life into hell, while he has a romance with Hannah. However, the archenemy of G-Girl and former high school sweetheart of Jenny, Professor Bedlam, proposes Matt to lure Jenny to strip her superpowers."
516,Nacho Libre,100,PG,2006-06-16,Jared Hess,"Jack Black, Hector Jimenez, Ana de la Reguera, Richard Montoya, Darius Rose","Berated all his life by those around him, a monk follows his dream and dons a mask to moonlight as a Luchador (Mexican wrestler)."
517,Nanny McPhee,99,PG,2006-01-27,Kirk Jones,"Emma Thompson, Colin Firth, Thomas Sangster, Raphael Coleman, Jennifer Rae Daykin",Mr. Cedric Brown has just lost his wife and is now left with his seven children who misbehave so much that all the nannies have run away. Now he is told by a mysterious voice that he should get Nanny McPhee who is a magical woman with special powers.
518,Night at the Museum,108,PG,2006-12-22,Shawn Levy,"Ben Stiller, Carla Gugino, Robin Williams, Dick Van Dyke, Mickey Rooney","In New York, unemployed and divorced Larry Daley is a complete loser. His son Nick is very disappointed with his father who is going to be evicted. Larry accepts the job of night watchman in the Museum of Natural History and takes the place of three old security guards that have just retired in order to raise some money and pay his bills. On his first shift, Larry soon realizes that everything at the museum is not as it seems as the statues begin to come to life after the sun sets. The Museum transforms into complete chaos with the inexperienced Larry in charge as he learns that an old Egyptian stone that came to the Museum in 1950 brings these statues to life until dawn. When Larry brings his son to spend a night with him, the three old guards break into the Museum to try to steal the magical stone. Larry organizes all the historic characters to help him stop the criminals and save the museum."
519,Notes on a Scandal,91,R,2006-12-25,Richard Eyre,"Judi Dench, Cate Blanchett, Bill Nighy, Andrew Simpson, Philip Davis","The bitter, cynical and lonely Barbara Covett is a tough and conservative teacher, near to retirement, who is loathed by her colleagues and students. In the loneliness of her apartment, she spends her spare time writing her journal, taking care of her old cat Portia and missing her special friend Jennifer Dodd. When Sheba Hart joins the high-school as the new art teacher, Barbara dedicates her attention to the newcomer, writing sharp and unpleasant comments about her behavior and clothes. When Barbara helps Sheba in a difficult situation with two students, the grateful Sheba invites her to have lunch with her family. Sheba introduces her husband and former professor Richard Hart, who is about twenty years older than she; her rebellious teenager daughter Polly; and her son Ben that has Down's Syndrome. Barbara becomes close to Sheba, but when she accidentally discovers that Sheba is having an affair with the fifteen year-old student Steven Connolly, Barbara sees the chance to manipulate and get closer to Sheba, hiding the secret from the school headmaster. When Portia dies and Sheba does not stay with Barbara in the veterinary office to see Ben in a theater play, Barbara plots a Machiavellian revenge against Sheba, creating a scandal and consequent turmoil in their lives."
520,One Night With the King,123,PG,2006-10-13,Michael O. Sajbel,"Peter O'Toole, Tiffany Dupont, Omar Sharif, Luke Goss, John Rhys-Davies","The young Jewish girl, Hadassah, goes on to become the Biblical Esther, the Queen of Persia, who saves the Jewish nation from annihilation at the hands of its arch enemy."
521,Open Season,83,PG,2006-09-29,"Roger Allers, Jill Culton","Martin Lawrence, Ashton Kutcher, Gary Sinise, Jane Krakowski, Debra Messing","A happily domesticated grizzly bear named Boog, has his perfect world turned upside down after he meets Elliot, a scrawny, fast-talking one-horned wild mule deer. They both end up stranded together in the woods during hunting season and it's up to the duo to rally all the other forest animals and turn the tables on the hunters."
522,Over the Hedge,84,PG,2006-05-19,"Tim Johnson, Karey Kirkpatrick","Bruce Willis, Garry Shandling, Steve Carell, William Shatner, Wanda Sykes","A scheming raccoon fools a mismatched family of forest creatures into helping him repay a debt of food, by invading the new suburban sprawl that popped up while they were hibernating...and learns a lesson about family himself."
523,Pan's Labyrinth,115,R,2006-12-29,Guillermo del Toro,"Ivana Baquero, Ariadna Gil, Sergi Lopez, Maribel Verdu, Alex Angulo","In 1944 falangist Spain, a girl, fascinated with fairy-tales, is sent along with her pregnant mother to live with her new stepfather, a ruthless captain of the Spanish army. During the night, she meets a fairy who takes her to an old faun in the center of the labyrinth. He tells her she's a princess, but must prove her royalty by surviving three gruesome tasks. If she fails, she will never prove herself to be the the true princess and will never see her real father, the king, again."
524,Phat Girlz,99,PG-13,2006-04-07,Nnegest Likke,"Mo'Nique, Jimmy Jean-Louis, Godfrey, Kendra C. Johnson, Joyful Drake",Two plus-sized ladies meet the men of their dreams in the most unexpected of ways.
525,Pirates of the Caribbean: Dead Man's Chest,151,PG-13,2006-07-07,Gore Verbinski,"Johnny Depp, Orlando Bloom, Keira Knightley, Jack Davenport, Bill Nighy","Once again we're plunged into the world of sword fights and ""savvy"" pirates. Captain Jack Sparrow is reminded he owes a debt to Davy Jones, who captains the flying Dutchman, a ghostly ship, with a crew from hell. Facing the ""locker"" Jack must find the heart of Davy Jones but to save himself he must get the help of quick-witted Will Turner and Elizabeth Swan. If that's not complicated enough, Will and Elizabeth are sentenced to hang, unless will can get Lord Cutler Beckett Jack's compass, Will is forced to join another crazy adventure with Jack."
526,Poseidon,99,PG-13,2006-05-12,Wolfgang Petersen,"Kurt Russell, Josh Lucas, Richard Dreyfuss, Andre Braugher, Mia Maestro","On New Year's Eve, the luxury ocean liner Poseidon capsizes after being swamped by a rogue wave. The survivors are left to fight for their lives as they attempt to escape the sinking ship."
527,Pulse,85,PG-13,2006-08-11,Jim Sonzero,"Kristen Bell, Ian Somerhalder, Christina Milian, Rick Gonzalez, Jonathan Tucker","The hacker Josh invades the computer of Douglas Ziegler, who is developing a powerful wireless signal, and accidentally releases a mysterious force that takes the will to live of human beings, generating a suicide epidemic and increasing the force. His girlfriend and student of psychology, Mattie, sees each one of their common friends die and the destruction of the modern world, and together with her new acquaintance Dexter, they try to plan a virus developed by Josh in the network to shutdown the system and save mankind."
528,RV,99,PG,2006-04-28,Barry Sonnenfeld,"Robin Williams, Cheryl Hines, Josh Hutcherson, Jeff Daniels, Joanna 'JoJo' Levesque","Bob Munro and his dysfunctional family rent an RV for a road trip to the Colorado Rockies, where they ultimately have to contend with a bizarre community of campers."
529,Rocky Balboa,101,PG,2006-12-22,Sylvester Stallone,"Burt Young, Milo Ventimiglia, Geraldine Hughes, Antonio Tarver, Sylvester Stallone","Thirty years after the ring of the first bell, Rocky Balboa comes out of retirement and dons his gloves for his final fight; against the reigning heavyweight champ Mason 'The Line' Dixon."
530,Running Scared,119,R,2006-02-24,Wayne Kramer,"Paul Walker, Cameron Bright, Vera Farmiga, Karel Roden, Johnny Messner","After a drug-op gone bad, Joey Gazelle is put in charge of disposing the gun that shot a dirty cop. But things go wrong for Joey after a neighbor kid stole the gun and used it to shoot his abusive father. Now Joey has to find that kid and the gun before the police and the mob do."
531,Saw III,108,R,2006-10-27,Darren Lynn Bousman,"Tobin Bell, Shawnee Smith, Angus Macfadyen, Bahar Soomekh, Dina Meyer","Jeff is an anguished man, who grieves and misses his young son that was killed by a driver in a car accident. He has become obsessed for revenge against the man and reckless with his wife and daughter. When Dr. Lynn Denlon, who has troubles with her marriage, is abducted by the deranged Jigsaw's apprentice Amanda, she is brought to a gruesome warehouse to keep John Kramer alive in spite of having a terminal brain tumor. Amanda puts a necklace gadget full of explosives around Dr. Lynn's neck connected to John Kramer's life support system, and tells her that if he dies the device will explode. Meanwhile, Jeff is submitted to a sick game of forgiveness with surprising dark consequences."
532,Scary Movie 4,83,PG-13,2006-04-14,David Zucker,"Anthony Anderson, Craig Bierko, Carmen Electra, Chris Elliott, Anna Faris","The unemployed Cindy Campbell is hired to work in a cursed house as caretaker of an old lady and meets the ghost of a boy. Meanwhile, the teenager son Robbie and the young daughter Rachel of his next door neighbor and crane operator Tom Ryan are spending the weekend with their loser father. Cindy and Tom meet and fall in love for each other, but when Giant Tripods invade Earth, Tom escapes with Robbie and Rachel; Cindy travels to a village, trying to find the answer to a riddle to save the world; and the president of USA organizes the defense of the planet in UN under his intelligence and leadership."
533,School for Scoundrels,101,PG-13,2006-09-23,Todd Phillips,"Billy Bob Thornton, Jon Heder, Jacinda Barrett, Michael Clarke Duncan, Horatio Sanz",An unlucky meter reader enrolls in a confidence-building class so he can win the love of the girl of his dreams. The class turns out to be something quite different when it becomes clear to the young man that his professor has his sights set on the same girl.
534,Scoop,96,PG-13,2006-07-28,Woody Allen,"Woody Allen, Hugh Jackman, Scarlett Johansson, Ian McShane, Charles Dance","In the funeral of the famous British journalist Joe Strombel, his colleagues and friends recall how obstinate he was while seeking for a scoop. Meanwhile the deceased Joe discloses the identity of the tarot card serial killer of London. He cheats the Reaper and appears to the American student of journalism Sondra Pransky, who is on the stage in the middle of a magic show of the magician Sidney Waterman in London, and tells her that the murderer is the aristocrat Peter Lyman. Sondra drags Sid in her investigation, seeking for evidences that Peter is the killer. However, she falls in love with him and questions if Joe Strombel is right in his scoop."
535,See No Evil,84,R,2006-05-19,Gregory Dark,"Glenn 'Kane' Jacobs, Christina Vidal, Michael J. Pagan, Rachael Taylor, Samantha Noble","While investigating a call in an abandoned house, Officer Frank Williams and a rookie find a woman brutally blinded, but they are attacked by a huge psychopath with an ax; the rookie is killed and Frank shoots the criminal in the head, but has a severed arm. Four years later, the mutilated Frank is relocated, working as a guard in the County Detention Center. Frank goes with some delinquents to the Blackwell Hotel, an abandoned place since a fire burnt the last two floors, with the purpose of cleaning the location, preparing it to work as a shelter for the homeless; in return, the criminals will have their sentences reduced. During the night, the inmate Kira who has some Christian tattoos on her body is kidnapped by the deranged serial-killer Kane who collects the eyes of his victims, while the rest of the group is attacked by the psychopath with his ax."
536,She's the Man,105,PG-13,2006-03-17,Andy Fickman,"Amanda Bynes, Channing Tatum, Laura Ramsey, Vinnie Jones, Robert Hoffman","When her brother decides to ditch for a couple weeks in London, Viola heads over to his elite boarding school, disguises herself as him, and proceeds to fall for one of her soccer teammates. Little does she realize she's not the only one with romantic troubles, as she, as he, gets in the middle of a series of intermingled love affairs."
537,Silent Hill,125,R,2006-04-21,Christophe Gans,"Radha Mitchell, Sean Bean, Laurie Holden, Deborah Kara Unger, Kim Coates","A little girl who doesn't get enough sleep wakes up every night screaming ""silent hill."" One day her mother, driving through a thick fog, loses her daughter in a parallel world which hell itself would just not tolerate. Through all those atrocities and lack of trust, her daughter is living the biggest nightmare of her life."
538,Slither,96,R,2006-03-31,James Gunn,"Nathan Fillion, Elizabeth Banks, Gregg Henry, Michael Rooker, Tania Saulnier","In this blend of the B movie classic The Blob (1958), and some Romero's zombies film, a meteorite collides in a small town. Grant finds it, and is infected by a parasite worm, which installs in his brain and causes him a creepy transformation into a monster. Starla, his wife, and Bill, a policeman, will try to stop him and the plague of worms generated by the creature."
539,Snakes on a Plane,106,R,2006-08-18,David R. Ellis,"Samuel L. Jackson, Julianna Margulies, Nathan Phillips, Rachel Blanchard, Bobby Cannavale","While practicing motocross in Hawaii, Sean Jones witnesses the brutal murder of an important American prosecutor by the powerful mobster Eddie Kim. He is protected and persuaded by the FBI agent Neville Flynn to testify against Eddie in Los Angeles. They embark in the red-eye Flight 121 of Pacific Air, occupying the entire first-class. However, Eddie dispatches hundred of different species of snakes airborne with a time operated device in the luggage to release the snakes in the flight with the intent of crashing the plane. Neville and the passengers have to struggle with the snakes to survive."
540,Something New,100,PG-13,2006-02-03,Sanaa Hamri,"Sanaa Lathan, Simon Baker, Mike Epps, Donald Faison, Blair Underwood","Kenya McQueen is a successful African-American CPA, working her way to the top of the corporate ladder -- but her life has become all work and no play. Urged on by her friends to try something new and to let go of her dream of the ""ideal black man,"" she accepts a blind date with an architectural landscaper named Brian, only to cut the date short upon first sight, because Brian is white. The two meet again at a party, and Kenya hires Brian to landscape her new home. Over time, they hit it off, but Kenya's reservations about the acceptance their romance will find among her friends and family threatens everything. An intelligent romantic comedy that chooses to deal with issues of race and perception in a straight-forward way, from a point of view not often seen: that of a successful, upper-class black woman."
541,Stay Alive,86,PG-13,2006-03-24,William Brent Bell,"Jon Foster, Frankie Muniz, Samaire Armstrong, Sophia Bush, Jimmi Simpson","Loomis Crowley is testing the underground game Stay Alive with his friends Sarah and Rex. When the game is over, Loomis finds Rex and Sarah dead in their room, and he is pushed by a shadow from the staircase, breaking the banister and hanging the same way he died in the game. Loomis' sister, Emma, gives his game to his best friend, Hutch. They, and his friends Miller, Phineus with his sister October, Swink and Abigail play the game together. When Miller and Phineus die the same way they died in the game, the survivors disclose that the game is based on the life of the evil Countess Elizabeth Bathory. She was buried alive in the tower of her real state in the Geronge Plantation. With the police chasing them, and after the death of October, the survivors reach the house and try to find the corpse of the Countess to destroy her fiend."
542,Step Up,103,PG-13,2006-08-11,Anne Fletcher,"Channing Tatum, Jenna Dewan Tatum, Damaine Radcliff, Mario, Drew Sidora","Tyler Gage receives the opportunity of a lifetime after vandalizing a performing arts school, gaining him the chance to earn a scholarship and dance with an up and coming dancer, Nora."
543,Stick It,103,PG-13,2006-04-28,Jessica Bendinger,"Missy Peregrym, Jeff Bridges, Vanessa Lengies, Nikki SooHoo","Haley Graham is a former gymnast-turned-juvenile delinquent who, after one too many run-ins with the law, is forced to enroll at an elite gymnastics academy, the VGA in Houston, Texas which is run by the legendary Olympic gymnast Burt Vickerman. But the rebellious Haley is not welcomed into the academy by the other teenage gymnasts who despise her for walking out on her Junior Olympic team years earlier during a competition which cost them the gold medal. But Haley is not a docile person either and makes every effort to provoke conflicts with the other girls. Vickerman takes it upon himself to coach Haley in his own way to make her regain her self respect for the VGA's coming spot on the Gymnastic Nationals."
